{
  "category": "ClassicalLogic",
  "structures": [
    {
      "name": "Individual",
      "fields": [
        { "name": "name", "type": "string" },
        { "name": "isHuman", "type": "Human" },
        { "name": "isMortal", "type": "Mortal" }
      ]
    }
  ],
  "functors": [
    {
      "name": "humanImpliesMortal",
      "domain": "Human",
      "codomain": "Mortal",
      "law": "forall x. Human(x) -> Mortal(x)"
    }
  ],
  "proposition": {
    "kind": "compose",
    "functors": ["humanImpliesMortal"],
    "arg": {
      "kind": "witness",
      "structure": "Individual",
      "field": "isHuman",
      "selector": { "name": "Socrates" },
      "value": true,
      "path": ["individuals", { "name": "Socrates" }, "isHuman"]
    }
  },
  "ts_compat": {}
}
